{
  "id": "bench-be-001",
  "domain": "backend",
  "task": "Create Prisma migration and Supabase PostgreSQL RLS policies for tenant organization data isolation.",
  "expected_artifacts": [
    "prisma/schema.prisma",
    "prisma/migrations/tenant_rls.sql",
    "src/services/tenantService.ts"
  ],
  "required_tests": [
    "verify_tenant_id_foreign_key_indexed",
    "verify_rls_enabled_on_all_public_tables",
    "verify_cross_tenant_read_rejected"
  ],
  "failure_conditions": [
    "Missing CREATE POLICY on public table with tenant isolation",
    "Unindexed foreign key on organization_id causing table scans",
    "Prisma query bypassing tenant session context"
  ],
  "metrics": {
    "min_test_pass_rate": 1.0,
    "max_retry_count": 0,
    "max_token_budget": 5000,
    "max_execution_time_ms": 15000
  }
}
