{
  "id": "bench-fe-001",
  "domain": "frontend",
  "task": "Construct a new Course Dashboard component with progress charts and instructor badge.",
  "expected_artifacts": [
    "src/components/CourseDashboard.tsx",
    "src/components/CourseDashboard.test.tsx"
  ],
  "required_tests": [
    "verify_uxai_mockup_approval_event",
    "verify_zero_fai_premature_code",
    "verify_radix_aria_attributes"
  ],
  "failure_conditions": [
    "Fai generated UI components without prior UXAI MOCKUP_APPROVED event in telemetry",
    "Unescaped arbitrary color tokens used instead of semantic design token variables",
    "Missing screen reader accessible labels on interactive progress bars"
  ],
  "metrics": {
    "min_test_pass_rate": 1.0,
    "max_retry_count": 0,
    "max_token_budget": 4500,
    "max_execution_time_ms": 12000
  }
}
