{
  "id": "bench-sec-002",
  "domain": "security",
  "task": "Implement Three-Tier Defensive Access Boundary across Route Gate, Component Guard, and Action/DB Handler.",
  "expected_artifacts": [
    "src/routes/AdminGuard.tsx",
    "src/components/AdminActionButton.tsx",
    "src/api/adminActions.ts"
  ],
  "required_tests": [
    "verify_unauthorized_route_redirect",
    "verify_unauthorized_button_unrendered",
    "verify_direct_api_mutation_rejected_with_403"
  ],
  "failure_conditions": [
    "Relying solely on UI-level hiding while leaving API mutation endpoints open without session role check",
    "SuperAdmin permissions granted to commercial creator or student sessions"
  ],
  "metrics": {
    "min_test_pass_rate": 1.0,
    "max_retry_count": 0,
    "max_token_budget": 4000,
    "max_execution_time_ms": 9000
  }
}
