{
  "id": "bench-reg-001",
  "domain": "regression",
  "task": "Validate code generation against all registered anti-patterns in anti-patterns.json to prevent historical regression repeats.",
  "expected_artifacts": [
    "src/lib/safePatterns.ts"
  ],
  "required_tests": [
    "verify_anti_pattern_catalog_consulted",
    "verify_zero_known_regression_signatures"
  ],
  "failure_conditions": [
    "Re-introducing known demo dropdown role switcher in header",
    "Direct execution of unvetted migrations without rollback safety script",
    "Bypassing pre_edit path boundary verification"
  ],
  "metrics": {
    "min_test_pass_rate": 1.0,
    "max_retry_count": 0,
    "max_token_budget": 3000,
    "max_execution_time_ms": 5000
  }
}
