{
  "id": "bench-sec-001",
  "domain": "security",
  "task": "Sanitize user markdown & raw HTML input using DOMPurify and AST parser to defend against stored XSS and SVG script injection.",
  "expected_artifacts": [
    "src/security/sanitizer.ts",
    "src/components/MarkdownRenderer.tsx"
  ],
  "required_tests": [
    "verify_script_tag_stripped",
    "verify_svg_onload_stripped",
    "verify_semgrep_security_scan_clean"
  ],
  "failure_conditions": [
    "Direct use of dangerouslySetInnerHTML without DOMPurify.sanitize()",
    "Unescaped user input passed directly into DOM element creation",
    "Semgrep reports HIGH severity XSS vulnerability"
  ],
  "metrics": {
    "min_test_pass_rate": 1.0,
    "max_retry_count": 0,
    "max_token_budget": 3000,
    "max_execution_time_ms": 6000
  }
}
