{
  "id": "bench-arch-002",
  "domain": "architecture",
  "task": "Enforce Principle 1: Construct Project Workspace Sidebar ensuring 100% localized context with zero global platform link leakage.",
  "expected_artifacts": [
    "src/layouts/ProjectWorkspaceLayout.tsx",
    "src/navigation/projectSidebarItems.ts"
  ],
  "required_tests": [
    "verify_zero_global_market_wallet_links_in_subresource",
    "verify_all_navigation_routes_prefixed_with_project_id"
  ],
  "failure_conditions": [
    "Global Market, Global Wallet, or SuperAdmin feeds present in Project Workspace sidebar",
    "Hardcoded non-contextual route paths (e.g., href='/settings' instead of href='/projects/:id/settings')"
  ],
  "metrics": {
    "min_test_pass_rate": 1.0,
    "max_retry_count": 0,
    "max_token_budget": 3500,
    "max_execution_time_ms": 7500
  }
}
