{
  "id": "bench-fe-002",
  "domain": "frontend",
  "task": "Build accessible status badge collection with high contrast ratios and theme switching.",
  "expected_artifacts": [
    "src/components/StatusBadges.tsx",
    "src/tokens/badge-theme.css"
  ],
  "required_tests": [
    "verify_axe_core_wcag_aaa_contrast",
    "verify_dark_mode_variant_stacking"
  ],
  "failure_conditions": [
    "Color contrast ratio falls below 4.5:1 for normal text or 7:1 for AAA compliance",
    "Hardcoded hex colors used in Tailwind class strings"
  ],
  "metrics": {
    "min_test_pass_rate": 1.0,
    "max_retry_count": 0,
    "max_token_budget": 3500,
    "max_execution_time_ms": 8000
  }
}
